{
  "$schema": "./conformance-tests.schema.json",
  "name": "PsdlScenarioConformanceTests",
  "version": "0.3.0",
  "description": "End-to-end scenario evaluation tests. Validates that complete scenarios produce expected results when evaluated against test data.",
  "reference": "https://psdl-lang.org/spec/v0.3/scenarios",
  "conformanceLevel": "core",
  "notes": "v0.3 requires psdl_version field and forbids physical bindings in scenarios. Trends produce numeric values only; comparisons in logic layer.",

  "groups": [
    {
      "name": "DocumentValidation",
      "description": "Tests for document structure validation (Level 1 conformance)",
      "context": "scenario",
      "tests": [
        {
          "id": "doc_001",
          "name": "Valid minimal scenario",
          "scenario": {
            "psdl_version": "0.5",
            "scenario": {
              "name": "minimal_test",
              "version": "1.0.0"
            },
            "audit": {
              "intent": "Test minimal scenario structure",
              "rationale": "Validates parser accepts minimal valid document",
              "provenance": "PSDL Conformance Suite"
            },
            "signals": {
              "Cr": {
                "ref": "creatinine",
                "expected_unit": "mg/dL"
              }
            },
            "trends": {
              "cr_current": {
                "type": "float",
                "expr": "last(Cr)"
              }
            },
            "logic": {
              "cr_elevated": {
                "when": "cr_current >= 1.5"
              }
            }
          },
          "invalid": "false",
          "explanation": "Minimal scenario with all required fields"
        },
        {
          "id": "doc_002",
          "name": "Missing psdl_version",
          "scenario": {
            "scenario": {
              "name": "test",
              "version": "1.0.0"
            },
            "audit": {
              "intent": "Test intent",
              "rationale": "Test rationale",
              "provenance": "Test"
            },
            "signals": {},
            "logic": {}
          },
          "invalid": "semantic",
          "errorCode": "E002",
          "explanation": "psdl_version is required"
        },
        {
          "id": "doc_003",
          "name": "Missing audit block",
          "scenario": {
            "psdl_version": "0.5",
            "scenario": {
              "name": "test",
              "version": "1.0.0"
            },
            "signals": {},
            "logic": {}
          },
          "invalid": "semantic",
          "errorCode": "E002",
          "explanation": "audit block is required"
        },
        {
          "id": "doc_004",
          "name": "Missing signals",
          "scenario": {
            "psdl_version": "0.5",
            "scenario": {
              "name": "test",
              "version": "1.0.0"
            },
            "audit": {
              "intent": "Test intent",
              "rationale": "Test rationale",
              "provenance": "Test"
            },
            "logic": {}
          },
          "invalid": "semantic",
          "errorCode": "E002",
          "explanation": "signals section is required"
        },
        {
          "id": "doc_005",
          "name": "Missing logic",
          "scenario": {
            "psdl_version": "0.5",
            "scenario": {
              "name": "test",
              "version": "1.0.0"
            },
            "audit": {
              "intent": "Test intent",
              "rationale": "Test rationale",
              "provenance": "Test"
            },
            "signals": {}
          },
          "invalid": "semantic",
          "errorCode": "E002",
          "explanation": "logic section is required"
        },
        {
          "id": "doc_006",
          "name": "Unsupported psdl_version",
          "scenario": {
            "psdl_version": "99.0",
            "scenario": {
              "name": "test",
              "version": "1.0.0"
            },
            "audit": {
              "intent": "Test intent",
              "rationale": "Test rationale",
              "provenance": "Test"
            },
            "signals": {},
            "logic": {}
          },
          "invalid": "semantic",
          "errorCode": "E003",
          "explanation": "Unsupported major version"
        },
        {
          "id": "doc_007",
          "name": "Physical binding in signal (forbidden)",
          "scenario": {
            "psdl_version": "0.5",
            "scenario": {
              "name": "test",
              "version": "1.0.0"
            },
            "audit": {
              "intent": "Test intent",
              "rationale": "Test rationale",
              "provenance": "Test"
            },
            "signals": {
              "Cr": {
                "ref": "creatinine",
                "concept_id": 3016723
              }
            },
            "logic": {}
          },
          "invalid": "semantic",
          "errorCode": "E004",
          "explanation": "Physical bindings (concept_id) forbidden in scenario"
        },
        {
          "id": "doc_008",
          "name": "Audit intent too short",
          "scenario": {
            "psdl_version": "0.5",
            "scenario": {
              "name": "test",
              "version": "1.0.0"
            },
            "audit": {
              "intent": "Test",
              "rationale": "Test rationale that is long enough",
              "provenance": "Test"
            },
            "signals": {},
            "logic": {}
          },
          "invalid": "semantic",
          "explanation": "Audit intent must be at least 10 characters"
        },
        {
          "id": "doc_009",
          "name": "Comparison operator in trend expression (v0.3 violation)",
          "scenario": {
            "psdl_version": "0.5",
            "scenario": {
              "name": "test",
              "version": "1.0.0"
            },
            "audit": {
              "intent": "Test comparison in trend",
              "rationale": "v0.3 forbids comparison operators in trends",
              "provenance": "PSDL Conformance Suite"
            },
            "signals": {
              "Cr": {
                "ref": "creatinine"
              }
            },
            "trends": {
              "cr_elevated": {
                "type": "float",
                "expr": "delta(Cr, 48h) >= 0.3"
              }
            },
            "logic": {
              "alert": {
                "when": "cr_elevated"
              }
            }
          },
          "invalid": "syntax",
          "errorCode": "E001",
          "explanation": "CORE-031: Trend expressions MUST NOT contain comparison operators (>=, <=, etc.)"
        },
        {
          "id": "doc_010",
          "name": "State transition 'when' with inline expression",
          "scenario": {
            "psdl_version": "0.5",
            "scenario": {
              "name": "test",
              "version": "1.0.0"
            },
            "audit": {
              "intent": "Test state transition validation",
              "rationale": "State transition when must reference a logic rule",
              "provenance": "PSDL Conformance Suite"
            },
            "signals": {
              "Cr": {
                "ref": "creatinine"
              }
            },
            "logic": {
              "elevated": {
                "when": "last(Cr) >= 4.0"
              }
            },
            "state": {
              "initial": "normal",
              "states": ["normal", "critical"],
              "transitions": [
                {
                  "from": "normal",
                  "to": "critical",
                  "when": "last(Cr) >= 4.0"
                }
              ]
            }
          },
          "invalid": "syntax",
          "errorCode": "E006",
          "explanation": "STATE-003: Transition 'when' MUST reference a logic rule name, not an inline expression"
        },
        {
          "id": "doc_011",
          "name": "Decision output missing required 'from' field",
          "scenario": {
            "psdl_version": "0.5",
            "scenario": {
              "name": "test",
              "version": "1.0.0"
            },
            "audit": {
              "intent": "Test output validation",
              "rationale": "Output definitions require proper fields",
              "provenance": "PSDL Conformance Suite"
            },
            "signals": {
              "Cr": {
                "ref": "creatinine"
              }
            },
            "logic": {
              "elevated": {
                "when": "last(Cr) >= 1.5"
              }
            },
            "outputs": {
              "decision": {
                "in_cohort": {
                  "type": "boolean"
                }
              }
            }
          },
          "invalid": "semantic",
          "errorCode": "E002",
          "explanation": "DecisionOutput requires both 'type' and 'from' fields"
        },
        {
          "id": "doc_012",
          "name": "Feature output with neither 'from' nor 'expr'",
          "scenario": {
            "psdl_version": "0.5",
            "scenario": {
              "name": "test",
              "version": "1.0.0"
            },
            "audit": {
              "intent": "Test feature output validation",
              "rationale": "Feature outputs require either from or expr",
              "provenance": "PSDL Conformance Suite"
            },
            "signals": {
              "Cr": {
                "ref": "creatinine"
              }
            },
            "logic": {
              "elevated": {
                "when": "last(Cr) >= 1.5"
              }
            },
            "outputs": {
              "features": {